cleaned_text,textblob_sentiment
love able schedule times come also autodetect keep air quality best app easy use really makes difference apartment definitely fresher smelling cat hair picked air quickly,0.4238095238095239
husband got diagnosed allergy dogs problem eight dogs doctor told let dogs upstairs laughed suggested letting dogs bedroom laughter last suggestion let dogs bed guessed laughter could resolved change sheets twice week bought air purifier bedroom little machine fantastic set app works dont turn adjust anything ever also hooks alexa detects air quality adjusts fan speed automatically month ago suffered days really bad outside air everyone advised stay inside keep windows closed well little air purifier told us little bit air getting bad light top went red fan went high rest day get air quality notifications phone love thing would happily buy one every room house update bought another one family room,0.08734375
skeptical first bought absolutely love app super easy use control unit love feedback gives auto adjusts quickly refreshes air,0.2642857142857143
moved older farm home done lots remodeling end day still lot allergens air family dogs country dirt oregon wildfire smoke outrageous pollen counts really help notice difference feel child hypersensitive smell much get sick vomit smell certain meat cooking overstimulated mom struggles sound kitchen fan continuously sanity saver i’m home auto turns someone cooking kitchen help get rid smells well enough kiddo join us table dinner,-0.066666667
wish would purchased sooner dog guinea pigs bunnies little sq ft apartment ocd cant smells quickly realized adding free roam bunnies mix litter boxes fresh smellingand cant handle amazon ran bought browsing time reading countless reviews one well worth money soon arrived set downloaded app love set auto timer house smells fresh get compliments often many animals doesnt smell like best compliment ever also view filter life order filter based ive mine month still going strong filter still life left itand runs hours day things amazing,0.34455128205128205
ordered one office due allergens dust quiet often forget prefilter wonderful cat office sheds quite bit catches fur clog hepa filter app makes easy set schedule automatically turn ive breathing easier since got persistent cough ceased liked one office much ordered another house,0.3513888888888889
two pleased notifies air quality changes using app breeze lightweight easy move around easy set best investment home health,0.5916666666666667
replaced guardian air purifiers run course pleasantly surprised theyre light cords nice long position right wall theyre quite easy understand connected mine google home app ask google change fan speeds spent first couple weeks skeptical didnt see air quality change good moved one downstairs pet area sweeping moving things around noticed lights change color indicate drop air quality even skeptical thought well course air quality lower kick dust noticed big fluffy dog gets uppity hopping around tail wagging air quality changes super cool could change one thing id like see history air quality app regret buying high quality purifier brand,0.14139880952380954
far best air purifier bought love it’s also bluetooth adjust phone instead manually turning husband smokes garage sometimes smoke comes inside house don’t ever smell cigarette smell anymore,0.5333333333333333
