cleaned_text,textblob_sentiment
canary indoor cameras constantly alerting air quality compromised got try see cleaning air would help setting getting going detected poor air quality old house put main living room turned highest setting set hour app super user friendly also even hours air quality camera air cleaner changed dramatically pretty shocked earth breathing lol love control work alexa connected even google speakers upstairs connect voice activated commands even shuts im turn back app pretty amazing also like fact run using different filters basic carbon one comes pet one mildew chemical one would great broad spectrum filter one buy would gripe id even pay currently chose filter ill buy change randomly suppose arent expensive around bucks auto shipped every months recommended change time right app amazon even highest setting sounds like white noice peaceful bearing im going get one two floors house entire house stay fresher heavy bulky carry child could carry yet solid nice quality feel heavy duty plastic cheap overall dollar amount spent im super impressed say least great product im looking forward less alerts air quality canary indoor cameras,0.11729407979407978
opened box first thing noticed nice sleek purifier looks person decent size it’s heavy goes home esthetic also quiet unless it’s full blast check see it’s actually that’s quite app syncs machine also awesome super user friendly unit quick respond favorite aspect pet setting giant rottweilers one longer hair hair dust leave around house ridiculous ive purifier running couple days already tell difference dust glad made choice buy,0.25833333333333336
recently removed downdraft cooktop rather spend k another decided go ventless buy air purifier remove odors need since rarely used downdraft anyway also never air purifier really like ease use ability charcoal filter odors hepa filter get airborne pollutents prefilter washed catch dog hair quiet linked via alexa treat wifi resource controlled remotely larger unit treat sq feet intend buy another upstairs,0.1
favorite part air purifier autonomous autonomous feature levoit air purifier true standout constantly monitors air quality room adjusts settings accordingly means set forget effortlessly adapts changing needs living space breath fresh air value convenience setting customizing autonomous mode breeze userfriendly interface led display provides realtime air quality feedback allowing monitor purifiers performance glance levoit air purifiers autonomous feature breath fresh air world air purification takes hassle maintaining clean indoor air ensures family breathe easy day night responsive technology quiet operation energy efficiency userfriendly design stellar choice demand best air quality convenience cant recommend highly enough,0.33999999999999997
i’m really happy decided go model it’s super quiet can’t even tell it’s running unless really listen right close app updated works seamlessly iphone live dry dusty environment i’ve noticed dust normally covers room actually gone way used dust least every week actually went almost full month since we’ve unit air seems much better we’re happy results like app lets everything everything even aren’t home great quality relatively fair price it’s noticeable improvement air quality almost immediately environmentally friendly barely using electricity definitely another noteworthy plus happy customer recommend,0.25517020857929945
purifier great far month worked perfectly love washable prefilter seems like make hepa filter last lot longer low setting quiet hardly hear great use night next level still low enough watching tv barely noticeable love control phone app would highly recommend item right,0.19360317460317458
round rectangle one like one slim fit aesthetically room quiet remotely set timer click walk pass,0.025
severe allergies researching trying decide air purifier get hepa main thing looking finally settled one early christmas present got air purifier month ago it’s running room since wow difference far room always felt stale stuffy tried small cheap air purifier didn’t much wasn’t big enough room really help levoit one great love filters washable changed every months even different filter options use definitely want try petallergy one next like air purifier smart device another factor made choose one love control air purifier phone even i’m home app see air quality it’s detecting shows life filter also set reminders tell clean filters also schedule air purifier turn well mode there’s even timer highest mode would isn’t noisy even sleep you’re looking true hepa air purifier highly recommend one especially price fairly decent compared expensive ones i’ve looked,0.11824175824175825
seller probably wants kill purchased canceled one graded ordereding upstairs rooms got mini canceled got mini extra automatic pads bathroom windows cat genie cat dogs friend came upstairs pass smell test special area bathroom cat genie small room black dust forms ceiling fan room x master x master dogs got upstairs completed read reviews love software days love fresh air sleep mode don’t use put auto cleaning run hour fan mode hour air quality good sprayed glade air freshener filter ocean breeze smell look forward let mode love hair filter prevents filter getting junk hvac air filter shows grey dust well hopefully won’t changed often,0.2354978354978355
spare bathroom cats litter box door always open quick warning using next litter box probably dont use auto feature detected cats poop smell air quality went good bad air speed turned scared crap cat exactly air filter supposed though stars couldn’t smell poop keep constant boost necessary love product,0.028333333333333332
young puppy still potty pad trained also live apartment back air system allows smells apts flow home air purifier fantastic quickly automatically escalates cleaning process registers kind odor absolutely noise entire apt smells fresh clean well worth it’s price,0.278030303
granted brand purifier ive ever owned reviews good took leap im glad bought smaller purifiers first liked decided wanted something bigger cover downstairs took smaller downstairs one bedroom one bigger shape convenient placed center downstairs wall round ones need away wall intake ° one doesnt pulled away wall keep like inch wall live apartment lot neighbors smoke wd helps smell seeps didnt realize detected air quality bought popped alert watch pleasantly surprised didnt notice alert several hours went looked back time spike burning dinner stove lol love app keeps track everything id never remember change filters anything purifiers ive bought great wifi connectivity never issues ive set schedules one one always properly dont know helping health good smells keeping air fresher child ventilator extra piece mind hepa filters catch lot crap theyre disgusting change,0.13574380165289257
placed kitchen automatic mode keeps low airflow across sensor soon something starts getting bit smokey stove kicks fan speed clears fast needs get level even hear ive never seen kitchen haze cooking meal,0.1
great addition air purifier’s it’s connected wifi easy turn phone removes unwanted stale smells home little loud usually run night home,0.065972222
neighbor needs smoke weed frequently walls behind units radiator gaps connect unit purchased air purifier automatically detect weed odor eliminate whenever required unfortunately cannot detect weed odor automatically manually activate turbo mode longer smell weed odor unit im going give fivestar rating provides way get rid bad smells,-0.375
first air purifier ive bought far seems like job house smells cleaner dont notice much dust house random floating pet hair cats dogs quiet even higher settings youre gonna hear fan full blast super loud auto function seems work well fiance burnt bacon purifier detected poor air quality ramped fan speed detected good air quality sleep mode schedule functions expected efficient air cleaning setting auto mode says clean sqft however product description says clean sqft little misleading unless im seeing proper function overall good air purifier ill likely pick smaller unit bedroom,0.096626984
set appwifi pleased delivery ease use ive noticed lot less dust air still dust furniture week vacuum daily main living area lot cleaner try shut windows open havent changed filter yet,0.081944444
people dogs lousiana month clean times week automatic setting doesn’t pick pee smell puppies still go middle night carpet 🙄 leaving haven’t issues amount dust way less wiping tables shelves every day week,0.066666667
even impressed amount dust collects good size air intake openings near tvgaming stand since thats dust pet hair wants accumulate noisy higher fan speeds ya gonna ordered dead arrival poor quality control guess seems efficient levoit returnedwhich really loud little air pulling power filter beware levoit customer lack service dont accept phone calls email said ill buy sale,0.10625
works great got dog also bad habit vaping soon exhale vape ft away picks filters air lot modes pet mode use make noise neither,0.05
told particular brand coworkers reading reviews decided start small room one upgraded pet hair larger combine room works greats mobile app also nice,0.12916666666666665
air purifier works well fairly quiet price definitely worth money bought lower quality ones work well also however sale price one less covers area happy purchase im sure units could better would rather get particular one works particularly well regards pets purchased nd one yr old grandsons room breathing issues night propane heater clicks im hoping might help ill update later,0.1696969696969697
bought two home one floor easy set use right box remember take plastic wrap filter feel difference air quality couldn’t happier purifiers love much giving gifts holidays air quality indicator changes immediately cooking smoke air purifier also decreased amount dust home significantly highly recommend,0.1965079365079365
weve machine days done great job thus far features app work without issues responds quickly changes app keep auto kicks moment detects anything air light cannabis across room within minute machine kicks cleans air smoke odor cooking cool feature kids grandkids lock display cannot change settings also turn display lights together ill probably edit review filter changed first time far im pretty impressed,0.30833333333333335
air purifier helped much dogs cat live house can’t smell animals,0.16818181818181818
bought placed near cats litter box great job keeping air clean cant tell cats,0.4222222222222222
unit easy use fits wall takes little space runs quietly like color symbol changes air quality less optimal,0.019791666666666673
ordered cyber monday impressed run master bedroom suite square feet total auto mode works like charm display turns night turn lights time running can’t even hear would purchase,0.5
turn fan ring light appears soon fan begins recirculating air shows one four levels red meaning really poor blue meaning good worked years worth accumulations studyarchival stuffi stirred enough dust mold cat fur dander got red flash gradually change blue air began smell clean could breathe better got second fan bedroom slept better ever since began using third fan order go downstairs area sit evenings fans portable need put one needed often turn bedroom fan pet setting fan slows gets quiet turns every hour check air quality runs long needed considering power amazingly quiet machine habit recommending things without reservation levoit fan hesitation get free machine paid stock like share information something regard useful pleasing good job levoit,0.18583333333333335
came levoit box banged hole one side seems working asked amazon box get one second unit ordered week first one shipped prime box able ship beat one back work days really like models round ones take lot space function,0.125
wanted get air purifier love one things it’s supposed would recommend anyone,0.5
easy set use wonderful clean air home,0.6
use product months gamechanger home large room purifier covers space effortlessly air quality light sensors fantastic addition ensuring optimal performance smart wifi feature adds whole new level convenience able control monitor air quality phone gamechanger washable filters ecofriendly also costeffective long run hepa filter powerhouse capturing pet hair allergies dust even smoke effectively weve noticed significant improvement air breathe truly made positive impact home environment star product highly recommend anyone looking reliable highperforming air purifier,0.2840862708719852
dont even notice running light weight matches décor,0.4
product legit effective super easy use definitely it’s job highly recommend,0.30533333333333335
highly recommend purifier super reliable brings peace mind work harsh resins printing lot soldering around crank max im working things makes feel lot better hopefully actually something lol say times searing steakcooking results smoke seems make purifier output smell wet dog experience wait day two usually takes,0.15541666666666665
old machine working well searching another sound soft use filter sound machine white noise perfect balance us room room large master bedroom works great noticed allergies better much snoring huge plus highly recommend,0.3561904761904762
beyond expectations totally worth price recommend household wont regret,0.3
happy paid extra cash model really solid every category clean air quickly sons room nasty allergies ridiculously easy set schedules get live updates air quality whenever want installingchanging filter straightforward nononsense washable prefilter great extends life filter keeping dog hair etc thing well thought piece equipment well likely buy several rooms house strongly recommend,0.206002331
quiet sensor detects bad air comes automatically use around cats’ litter box,-0.35
like seems work quieter old one didnt phone app part feel unnecessary bought second one second floor dw,-0.075
dogs sleep outstanding job collecting dog hair controlling smell,0.5
love thing it’s right size get way good surface area air intake auto mode it’s done great job detecting air changing go blow smoke near watch work dim lights night everything right unit love app daughter autistic cannot resist messing anything lights buttons app set purifier want lock controls look lights touch wants without changing anything shutting might seem small people home game changing,0.21845238095238095
really nice air filter could always wish cheaper honestly everything expected,0.36666666666666664
great product love app integration,0.65
one favorite hepa systems fast improvement digital meters show drastic improvement within minutes measuring best recordable air quality day,0.425
love air purifier works amazing didnt realize filters one like app comes well great product expensive,0.35000000000000003
using sq ft home works great sense dust aerosol sprays etc another room auto mode kick pretty quiet time doesnt interrupt sleep placed bedroom also love control app also filter super easy clean replace,0.3833333333333333
first fourth singleroom intended air filter ive bought last year one another levoit white round one tall one sit behind two monitors desk two airtok half tall levoit black round well dissatisfied round design proving bit space consuming looking slimmer design levoit design perfect meets needs holy cow everything else smart vital amaaaaazing knew bluetoothwifi enabled came app remote connectivity idea going easy setup manage box open first run minutes complete setup tools needed difficult open packaging removal protective plastic wrapping seconds setup app measures air quality automagically completed setup yesterday around pm come automagically cleaned air times without anything app gives report air monitoring detection cleaning etc next morning already done systems ever love app deserves entire review far expected assumed would basic bluetooth management app basically turn system onoff seriously wild wellness sections air quality sleep modes quality triggers alert management schedules different control settings different times device controls different rooms stuff device really put thought time app warranty management part ordering app well like echo device management alexa app hp smart app pretty much everything need inside vesync app looks sharp tech smooth minimal design controls top led touch control smart smart smart totally happy purchase possible improvement could make would feedback world small appliance devices universal power cabling would great could get whatever length power cable needed whatever room thats true sorts things like desk fans coffee makers etc etc thats really levoit thats power strips literally thats could possible think everything easy easy easy smart,0.1199514991181658
must buy product look picturesvideos details bought back may ish ft home it’s placed middle hallway three dogs mainly got house moved weird stuffy smell top dogs indooroutdoor needed kind air purification purifier app works great tells much filter life turn onoff anywhere pictures attached first time ever change filter… actually read instructions says clean top filter every months actual filter could last longer… see mine months oops haha easy clean honestly pretty shocking much hair dust it’s collected months loved product much bought another one mom suffering lingering cough week feel difference air much cleaner easier breathe highly recommend,0.19138888888888891
love little thing much im buying nd one replace old purifier bedroom one currently living room works like charm washable prefilter keeps pet hair heap filter different varieties hepa filters buy means choose level filtration allergies everything buy highest grade benefit quiet even full fan speed quieter tower fan highly recommend,0.1247222222222222
family member needed way set home many shredding rabbits need rabbits like miss air purifier sometimes give nice things help orders go house clean check weekly force pick take back home see bunnies get back senses know took st place really pulls lot pet fur works well low high settings even pet setting that’s high speed color scheme shows different colors different air qualities levels app controls even better controlled away home even turned app infact functions work app well manually it’s well put together,0.2072222222222222
unit great haven’t yet filters washable rectangular shape makes easy fit different spaces also love air quality gauge… red means air n ed’s major cleaning sfter cooking steak yellow green finally blue air clean means turn save electricity,0.21477272727272725
easy use excellent job cleaning air sleep night,0.7166666666666667
size good takes little bit clear odors quiet easy unpack set lightweight buttons top easy use shuts job done good value room without noticed ive months didnt set phone app yet use top buttons quicky turn run two hours circle red think clears air circle turns white,0.2890151515151515
love products smaller unit bought bigger lager room app perfect unit,0.375
house smells musty basement spent k waterproofing basement upstairs still smell musty purchased hoping would work musty allergens definitely worked put forced high fan week get smell automatic setting turn since didn’t recognize musty bad air quality,-0.188
love everything ap,0.5
good job dog hair dust doesnt get rid make difference pleased,0.6
second levoit birthday hard understand app doesnt show indoor price numerical value basis model app,-0.145833333
got old home seem work well faulty one replaced like app integration fact control digital personal assistant choice prefilter easy clean main filter easy replace,0.21428571428571427
smartly designed low noise auto mode kicks sucks cooking smoke app convenient,-0.028571429
quiet sound compact easy setup sure really filter air force sq ft apartment though product description says square feet may order another one bedroom depending unit performs,0.3066666666666667
using couple months great great job purifying air…when it’s bought got couple kittens allergies struggling loved display lock feature problem kitten jumps still somehow turn app makes sound like turn display lock within app buttons disabled true frustrating kittens turn won’t find next morning high power fan little loud conference calls,0.2293181818181818
works great would recommend,0.8
wanted quality air purifier affordable yet quiet 🤫 think found winner sleep much better put noisier one living room bonus since gives better air apartment would definitely recommend,0.25
price thing great gets rid cigar smoke well automatic dont think really detects smoke turns leave time easy install clean filters quiet,0.36
home dusty decided add dogs dust dirt flies around insane different purifier didn’t much decided try one works well impressed,-0.04
thing works great barely audible automatic mode sometimes detect things like pet hair spool louder thrum things good like core slightly better sensitive air quality meter like one slightly better form factor fits tightly wall sound clean maybe db quiet mode quite db advertise filters expensive good filters always expensive,0.22600732600732604
excellent investment,1
air purifier seems work really read anything buy good,0.44999999999999996
like compact yet powerful purifier second runs quiet,0.1
air purifier great automatically sucks odor particles litter boxes even large cigar app tells air quality lowered purify air automatically quickly mention whisper quiet app extremely helpful many ways i’ve lost lbs wellnessdiet part vesync app try,0.2032312925170068
exactly needed space like automatic setting sensors indicate air dirty quiet works well,-0.116666667
one bedroom carpet gets dusty allergies great ability adjust want run wonderful definitely choice years come,0.35
dont lot reviews thing amazing efficient set auto takes care even gives notifications air dirty turning clean turning one bedroom one daughters bedroom glad bought oh also humidifier brand great keep great work levoit,0.41111111111111115
im using basementto clean musky air month quiet odorless,0.18333333333333335
different levoit purifier bedroom love wanted secondary unit litter box area cat model seemed like perfect fit needed purifier service small area auto feature sounded like would effectively target daily litter clouds scooping expectations met unit operates low level day soon scoop litter box ring turns red quickly sucks dust air noticed comes cooking anything produces smoke helps prevent house holding smell overall impressed product,0.20384615384615387
works great love color indicators isn’t large love night mode,0.5035714285714286
fast love app,0.35
bought mom christmas gave early loves wakes without sinus issues hasnt happened long time dehumidifier levoit knew giving topquality item,0.025
took mins setup via app userfriendly indeed placed near kitchen area fan kicks theres cooking event happening youd get alert air cleared buttons unit easy read press simple app indicates much life left filter base usage date installed convenient basic historical metrics shows vs live illinois comed eligible rebate model since energy star certified ive received rebate check definitely legit makes unit much affordable,0.024517906336088156
gave stars haven’t received electric bill yet know energy efficient mine sitting dining table it’s center space main unwanted air gathering course move visitors nice style easy use activated charcoal filter removes odors dust quickly removes fumes coming neighbors apt slowly difference smokey air fumes stuff difference air purifier really working hard get job done it’s weeks different times handle high speed noise easily awake isn’t loud quieter box fan sure electric bill arrives i’ll know give purifier th star,0.20249999999999996
construction going across hall building figured time invest one i’m happy got one apt newly renovated moved still smelt bit like construction mention really hallway made smell go away air also feels much clearer there’s big jump common hallway inside place app works seamlessly customer service great got error trying initiate warranty apparently come already set highly recommend works well cooking small space well,0.208030303
happy purchase works great keep air clean fresh really like able monitor air quality thru app away,0.49444444444444446
works great,0.8
links google set timer,0
absolutely love purifier ease use able access phone great friend visit saw ordered one dianne,0.6
love fact set schedule never worry turning app works perfect even alerts low air quality… still trying figure helping allergies seem somewhat better…time tell,0.5
first would like say purifier works incredibly well extremely quiet even highest setting definitely expected much louder could run bedroom virtually disruption nice bonus hate sound fans design simple understand removing old filter replacing new one quick process bought cats wanted pet smell removed arrived home disappointed thing removed smell everything apartment however said moved room room order effectively cleanse air space despite range leaving one location expecting preform best ability would take quite awhile properly eliminate old “dirty air” entirety living areas would definitely suggest changing placement best results air purifiers one remove smell candles essential oils keep mind burn run purifier turned overall setup quick easy absolutely purchase another one,0.17345454545454547
love app clean filter along app giving access variety health improvements fasting count steps etc cool like small don’t like small it’s nice cuz doesn’t take much room i’m surprised small device clean air quickly would buy also branded one room works great,0.23888888888888893
